{
  "schema": "specnav.verification.authority-chain-anchor.v1",
  "change_id": "verification-2-0",
  "logs": {
    "transition_proposals": {
      "kind": "transition_proposal",
      "path": "v2/transition-proposals.jsonl",
      "sequence": 0,
      "latest_digest": null,
      "terminal_envelope_id": null
    },
    "transition_receipts": {
      "kind": "transition_application",
      "path": "v2/transition-receipts.jsonl",
      "sequence": 0,
      "latest_digest": null,
      "terminal_envelope_id": null
    },
    "attempt_facts": {
      "kind": "attempt_fact",
      "path": "v2/attempt-facts.jsonl",
      "sequence": 5,
      "latest_digest": "12eb0d2dee9eb48bd1b0cba643c4a84d352b7ff84b69bbed559ebd855a13764d",
      "terminal_envelope_id": "trusted-fact-ed80b1a0289eba6976c74498bf283e307a33ccc1b95c72873c172d2ec8147353"
    }
  },
  "anchored_at": "2026-08-09T08:05:43.219Z",
  "id": "authority-chain-anchor-00615a8212333146d9d03e095dec4e7541ed911574a71dca404379260a5463b4",
  "signature_algorithm": "hmac-sha256",
  "signature": "0f633ae74ba647ffc57c01eb8e7c3e76f0efb1c586f7ba49ef0cf8b39382ecd0"
}
